{
  "schemaVersion": "1.0.0",
  "analysisId": "e6c1c93e-6f43-4f16-bbe0-30761998a4db",
  "summary": {
    "headline": "High-value bilingual campaign opportunity",
    "recommendation": "Proceed with standard diligence",
    "score": 78.2
  },
  "extractedRfp": {
    "schemaVersion": "1.0.0",
    "analysisId": "e6c1c93e-6f43-4f16-bbe0-30761998a4db",
    "extractionDate": "2026-02-10T12:00:00Z",
    "clientName": "Saudi Aramco",
    "projectName": "Brand Refresh Campaign 2026",
    "projectDescription": "Brand refresh across digital and campaign channels.",
    "scopeOfWork": "Exact RFP scope text.",
    "evaluationCriteria": "Exact RFP evaluation text.",
    "requiredDeliverables": [{ "item": "Technical proposal", "source": "verbatim" }],
    "importantDates": [
      { "title": "Submission Deadline", "date": "2026-03-15", "type": "submission_deadline", "isCritical": true }
    ],
    "submissionRequirements": {
      "method": "Email",
      "email": "procurement@example.com",
      "physicalAddress": null,
      "format": "PDF",
      "copies": null,
      "otherRequirements": []
    },
    "redFlags": [],
    "missingInformation": [],
    "confidenceScores": { "overall": 0.9 },
    "completenessScore": 0.9,
    "warnings": [],
    "qualityFlags": [],
    "evidence": [
      { "field": "scopeOfWork", "page": 3, "excerpt": "Scope section" }
    ]
  },
  "scopeAnalysis": {
    "schemaVersion": "1.0.0",
    "analysisId": "e6c1c93e-6f43-4f16-bbe0-30761998a4db",
    "taxonomyVersion": "sha256:fixture",
    "scopeItems": ["Brand strategy"],
    "unclassifiedItems": [],
    "matches": [
      {
        "scopeItem": "Brand strategy",
        "service": "Brand strategy",
        "class": "full",
        "confidence": 0.95,
        "classificationSource": "semantic"
      }
    ],
    "agencyServicePercentage": 1,
    "outsourcingPercentage": 0,
    "outputQuantities": {
      "videoProduction": 1,
      "motionGraphics": 0,
      "visualDesign": 2,
      "contentOnly": 0
    },
    "outputTypes": ["videoProduction", "visualDesign"],
    "warnings": []
  },
  "clientResearch": {
    "schemaVersion": "1.0.0",
    "analysisId": "e6c1c93e-6f43-4f16-bbe0-30761998a4db",
    "companyName": "Saudi Aramco",
    "companyProfile": {
      "entityType": "public_company",
      "industry": "Oil & Gas",
      "confidence": 0.97,
      "sources": ["Tadawul"]
    },
    "financialIndicators": {
      "marketingBudgetIndicator": "VERY_HIGH",
      "confidence": 0.9
    },
    "digitalPresence": {
      "bilingual": true,
      "confidence": 0.95
    },
    "advertisingActivity": { "confidence": 0.84 },
    "positiveSignals": ["Strong ad activity"],
    "researchMetadata": {
      "sourcesUsed": 8,
      "englishSources": 4,
      "arabicSources": 4,
      "overallConfidence": 0.9,
      "researchDate": "2026-02-10",
      "providerStats": [
        {
          "provider": "tavily",
          "attempts": 4,
          "successes": 4,
          "failures": 0,
          "retries": 0,
          "rateLimitedCount": 0,
          "finalStatus": "ok",
          "avgLatencyMs": 602.1,
          "p95LatencyMs": 731,
          "healthScore": 91.5,
          "lastError": null
        },
        {
          "provider": "exa",
          "attempts": 2,
          "successes": 2,
          "failures": 0,
          "retries": 0,
          "rateLimitedCount": 0,
          "finalStatus": "ok",
          "avgLatencyMs": 640.2,
          "p95LatencyMs": 715,
          "healthScore": 89.3,
          "lastError": null
        },
        {
          "provider": "brave",
          "attempts": 2,
          "successes": 1,
          "failures": 1,
          "retries": 1,
          "rateLimitedCount": 1,
          "finalStatus": "degraded",
          "avgLatencyMs": 1210.4,
          "p95LatencyMs": 1880,
          "healthScore": 72.4,
          "lastError": "Brave request failed: 429"
        },
        {
          "provider": "firecrawl",
          "attempts": 1,
          "successes": 1,
          "failures": 0,
          "retries": 0,
          "rateLimitedCount": 0,
          "finalStatus": "ok",
          "avgLatencyMs": 900,
          "p95LatencyMs": 900,
          "healthScore": 86.2,
          "lastError": null
        }
      ]
    },
    "confidence": 0.9,
    "evidence": [
      { "claim": "Tier-1 source", "source": "Tadawul", "tier": 1 }
    ]
  },
  "financialScore": {
    "schemaVersion": "1.0.0",
    "analysisId": "e6c1c93e-6f43-4f16-bbe0-30761998a4db",
    "baseScore": 82.4,
    "redFlagPenalty": 3,
    "completenessPenalty": 1.2,
    "finalScore": 78.2,
    "recommendationBand": "GOOD",
    "factorBreakdown": [
      {
        "factor": "Project Scope Magnitude",
        "weight": 0.18,
        "score": 85,
        "contribution": 15.3,
        "evidence": ["20+ deliverables"],
        "status": "scored",
        "identified": true
      }
    ],
    "rationale": "Strong fit with manageable risks."
  },
  "warnings": [],
  "generatedAt": "2026-02-10T12:05:00Z"
}
